1	Chrysalde, Vous venez, dites-vous, pour lui donner la main ?
1	Oui, je veux terminer la chose dans demain.
1	Nous sommes ici seuls ; et l'on peut, ce me semble,
1	Sans craindre d'être ouïs, y discourir ensemble.
1	Voulez-vous qu'en ami je vous ouvre mon coeur ?
1	Votre dessein pour vous me fait trembler de peur ;
1	Et de quelque façon que vous tourniez l'affaire,
1	Prendre femme, est à vous un coup bien téméraire.
1	Il est vrai, notre ami. Peut-être que chez vous
1	Vous trouvez des sujets de craindre pour chez nous ;
1	Et votre front, je crois, veut que du mariage
1	Les cornes soient partout l'infaillible apanage.
1	Ce sont coups du hasard, dont on n'est point garant ;
1	Et bien sot, ce me semble, est le soin qu'on en prend.
1	Mais quand je crains pour vous, c'est cette raillerie
1	Dont cent pauvres maris ont souffert la furie ;
1	Car enfin vous savez, qu'il n'est grands, ni petits,
1	Que de votre critique on ait vus garantis ;
1	Que vos plus grands plaisirs sont, partout où vous êtes,
1	De faire cent éclats des intrigues secrètes...
1	Fort bien : est-il au monde une autre ville aussi,
1	Où l'on ait des maris si patients qu'ici ?
1	Est-ce qu'on n'en voit pas, de toutes les espèces,
1	Qui sont accommodés chez eux de toutes pièces ?
1	L'un amasse du bien, dont sa femme fait part
1	À ceux qui prennent soin de le faire cornard.
1	L'autre un peu plus heureux, mais non pas moins infâme,
1	Voit faire tous les jours des présents à sa femme,
1	Et d'aucun soin jaloux n'a l'esprit combattu,
1	Parce qu'elle lui dit que c'est pour sa vertu.
1	L'un fait beaucoup de bruit, qui ne lui sert de guères ;
1	L'autre, en toute douceur, laisse aller les affaires,
1	Et voyant arriver chez lui le damoiseau,
1	Prend fort honnêtement ses gants et son manteau.
1	L'une de son galant, en adroite femelle,
1	Fait fausse confidence à son époux fidèle,
1	Qui dort en sûreté sur un pareil appas,
1	Et le plaint, ce galant, des soins qu'il ne perd pas ,
1	L'autre, pour se purger de sa magnificence,
1	Dit qu'elle gagne au jeu l'argent qu'elle dépense ;
1	Et le mari benêt, sans songer à quel jeu,
1	Sur les gains qu'elle fait, rend des grâces à Dieu.
1	Enfin, ce sont partout des sujets de satire,
1	Et comme spectateur ne puis-je pas en rire ?
1	Puis-je pas de nos sots...
1	Oui : mais qui rit d'autrui,
1	Doit craindre, qu'en revanche, on rie aussi de lui.
1	J'entends parler le monde ; et des gens se délassent
1	À venir débiter les choses qui se passent ;
1	Mais, quoi que l'on divulgue aux endroits où je suis,
1	Jamais on ne m'a vu triompher de ces bruits ;
1	J'y suis assez modeste ; et, bien qu'aux occurrences
1	Je puisse condamner certaines tolérances ;
1	Que mon dessein ne soit de souffrir nullement,
1	Ce que d'aucuns maris souffrent paisiblement,
1	Pourtant je n'ai jamais affecté de le dire ;
1	Car enfin il faut craindre un revers de satire,
1	Et l'on ne doit jamais jurer sur de tels cas,
1	De ce qu'on pourra faire, ou bien ne faire pas.
1	Ainsi quand à mon front, par un sort qui tout mène,
1	Il serait arrivé quelque disgrâce humaine,
1	Après mon procédé, je suis presque certain
1	Qu'on se contentera de s'en rire sous main ;
1	Et peut-être qu'encore j'aurai cet avantage,
1	Que quelques bonnes gens diront, que c'est dommage !
1	Mais de vous, cher Compère, il en est autrement ;
1	Je vous le dis encore, vous risquez diablement.
1	Comme sur les maris accusés de souffrance,
1	De tout temps votre langue a daubé d'importance,
1	Qu'on vous a vu contre eux un diable déchaîné ;
1	Vous devez marcher droit, pour n'être point berné ;
1	Et s'il faut que sur vous on ait la moindre prise,
1	Gare qu'aux carrefours on ne vous tympanise,
1	Et...
1	Mon Dieu, notre ami, ne vous tourmentez point ;
1	Bien huppé qui pourra m'attraper sur ce point.
1	Je sais les tours rusés, et les subtiles trames
1	Dont pour nous en planter savent user les femmes,
1	Et comme on est dupé par leurs dextérités,
1	Contre cet accident j'ai pris mes sûretés ;
1	Et celle que j'épouse a toute l'innocence
1	Qui peut sauver mon front de maligne influence.
1	Et que prétendez-vous qu'une sotte en un mot...
1	Épouser une sotte, est pour n'être point sot.
1	Je crois, en bon chrétien, votre moitié fort sage ;
1	Mais une femme habile est un mauvais présage,
1	Et je sais ce qu'il coûte à de certaines gens,
1	Pour avoir pris les leurs avec trop de talents.
1	Moi j'irais me charger d'une spirituelle,
1	Qui ne parlerait rien que cercle et que ruelle ?
1	Qui de prose et de vers, ferait de doux écrits,
1	Et que visiteraient Marquis et beaux Esprits,
1	Tandis que, sous le nom du mari de Madame,
1	Je serais comme un saint, que pas un ne réclame ?
1	Non, non, je ne veux point d'un esprit qui soit haut ;
1	Et femme qui compose en sait plus qu'il ne faut.
1	Je prétends que la mienne, en clartés peu sublime,
1	Même ne sache pas ce que c'est qu'une rime ;
1	Et s'il faut qu'avec elle on joue au corbillon,
1	Et qu'on vienne à lui dire à son tour, qu'y met-on ?
1	Je veux qu'elle réponde, une tarte à la crème ;
1	En un mot, qu'elle soit d'une ignorance extrême ;
1	Et c'est assez pour elle, à vous en bien parler,
1	De savoir prier Dieu, m'aimer, coudre et filer.
1	Une femme stupide est donc votre marotte ?
1	Tant, que j'aimerais mieux une laide, bien sotte
1	Qu'une femme fort belle avec beaucoup d'esprit.
1	L'esprit, et la beauté...
1	L'honnêteté suffit.
1	Mais comment voulez-vous, après tout, qu'une bête
1	Puisse jamais savoir ce que c'est qu'être honnête ?
1	Outre qu'il est assez ennuyeux, que je crois,
1	D'avoir toute sa vie une bête avec soi,
1	Pensez-vous le bien prendre, et que sur votre idée
1	La sûreté d'un front puisse être bien fondée ?
1	Une femme d'esprit peut trahir son devoir ;
1	Mais il faut pour le moins qu'elle ose le vouloir ;
1	Et la stupide au sien peut manquer d'ordinaire,
1	Sans en avoir l'envie et sans penser le faire.
1	À ce bel argument, à ce discours profond,
1	Ce que Pantagruel à Panurge répond :
1	Pressez-moi de me joindre à femme autre que sotte,
1	Prêchez, patrocinez jusqu'à la pentecôte ;
1	Vous serez ébahi, quand vous serez au bout,
1	Que vous ne m'aurez rien persuadé du tout.
1	Je ne vous dis plus mot.
1	Chacun a sa méthode.
1	En femme, comme en tout, je veux suivre ma mode ;
1	Je me vois riche assez, pour pouvoir, que je crois,
1	Choisir une moitié, qui tienne tout de moi,
1	Et de qui la soumise, et pleine dépendance
1	N'ait à me reprocher aucun bien, ni naissance.
1	Un air doux, et posé, parmi d'autres enfants,
1	M'inspira de l'amour pour elle dès quatre ans :
1	Sa mère se trouvant de pauvreté pressée,
1	De la lui demander il me vint la pensée,
1	Et la bonne paysanne, apprenant mon désir,
1	À s'ôter cette charge eut beaucoup de plaisir.
1	Dans un petit couvent, loin de toute pratique,
1	Je la fis élever selon ma politique,
1	C'est-à-dire ordonnant quels soins on emploierait,
1	Pour la rendre idiote autant qu'il se pourrait.
1	Dieu merci, le succès a suivi mon attente,
1	Et grande, je l'ai vue à tel point innocente,
1	Que j'ai béni le Ciel d'avoir trouvé mon fait,
1	Pour me faire une femme au gré de mon souhait.
1	Je l'ai donc retirée ; et comme ma demeure
1	À cent sortes de monde est ouverte à toute heure,
1	Je l'ai mise à l'écart, comme il faut tout prévoir,
1	Dans cette autre maison, où nul ne me vient voir ;
1	Et pour ne point gâter sa bonté naturelle,
1	Je n'y tiens que des gens tout aussi simples qu'elle.
1	Vous me direz pourquoi cette narration ?
1	C'est pour vous rendre instruit de ma précaution.
1	Le résultat de tout, est qu'en ami fidèle,
1	Ce soir, je vous invite à souper avec elle :
1	Je veux que vous puissiez un peu l'examiner,
1	Et voir, si de mon choix on me doit condamner.
1	J'y consens.
1	Vous pourrez, dans cette conférence,
1	Juger de sa personne, et de son innocence.
1	Pour cet article-là, ce que vous m'avez dit,
1	Ne peut...
1	La vérité passe encore mon récit.
1	Dans ses simplicités à tous coups je l'admire,
1	Et parfois elle en dit, dont je pâme de rire.
1	L'autre jour (pourrait-on se le persuader)
1	Elle était fort en peine, et me vint demander,
1	Avec une innocence à nulle autre pareille,
1	Si les enfants qu'on fait, se faisaient par l'oreille.
1	Je me réjouis fort, Seigneur Arnolphe...
1	Bon !
1	Me voulez-vous toujours appeler de ce nom ?
1	Ah ! Malgré que j'en aie, il me vient à la bouche,
1	Et jamais je ne songe à Monsieur de la Souche.
1	Qui diable vous a fait aussi vous aviser,
1	À quarante et deux ans, de vous débaptiser ?
1	Et d'un vieux tronc pourri de votre métairie,
1	Vous faire dans le monde un nom de Seigneurie ?
1	Outre que la maison par ce nom se connaît,
1	La Souche, plus qu'Arnolphe, à mes oreilles plaît.
1	Quel abus de quitter le vrai nom de ses pères
1	Pour en vouloir prendre un bâti sur des chimères ?
1	De la plupart des gens c'est la démangeaison ;
1	Et, sans vous embrasser dans la comparaison,
1	Je sais un paysan, qu'on appelait Gros-Pierre,
1	Qui n'ayant, pour tout bien qu'un seul quartier de terre,
1	Y fit tout à l'entour faire un fossé bourbeux,
1	Et de Monsieur de l'Isle en prit le nom pompeux.
1	Vous pourriez vous passer d'exemples de la sorte :
1	Mais enfin de la Souche est le nom que je porte,
1	J'y vois de la raison, j'y trouve des appas,
1	Et m'appeler de l'autre, est ne m'obliger pas.
1	Cependant la plupart ont peine à s'y soumettre,
1	Et je vois même encore des adresses de lettre...
1	Je le souffre aisément de qui n'est pas instruit ;
1	Mais vous...
1	Soit. Là-dessus nous n'aurons point de bruit,
1	Et je prendrai le soin d'accoutumer ma bouche
1	À ne plus vous nommer que Monsieur de la Souche.
1	Adieu : je frappe ici, pour donner le bonjour,
1	Et dire seulement que je suis de retour.
1	CHRYSALDE, s'en allant.
1	Ma foi je le tiens fou de toutes les manières.
1	ARNOLPHE, seul.
1	Il est un peu blessé sur certaines matières.
1	Chose étrange de voir comme avec passion
1	Un chacun est chaussé de son opinion !
1	Holà.
1	Arnolphe, Alain et Georgette dans la maison.
1	Qui heurte ?
1	Ouvrez. On aura, que je pense,
1	Grande joie à me voir après dix jours d'absence.
1	Qui va là ?
1	Moi.
1	Georgette !
1	Hé bien ?
1	Ouvre là-bas.
1	Vas-y toi.
1	Vas-y toi.
1	Ma foi je n'irai pas.
1	Je n'irai pas aussi.
1	Belle cérémonie,
1	Pour me laisser dehors. Holà ho, je vous prie.
1	Qui frappe ?
1	Votre maître.
1	Alain ?
1	Quoi ?
1	C'est Monsieur.
1	Ouvre vite.
1	Ouvre, toi.
1	Je souffle notre feu.
1	J'empêche, peur du chat, que mon moineau ne sorte.
1	Quiconque de vous deux n'ouvrira pas la porte
1	N'aura point à manger de plus de quatre jours.
1	Ha !
1	Par quelle raison y venir quand j'y cours ?
1	Pourquoi plutôt que moi ? Le plaisant strodagème !
1	Ôte-toi donc de là.
1	Non, ôte-toi, toi-même.
1	Je veux ouvrir la porte.
1	Et je veux l'ouvrir, moi.
1	Tu ne l'ouvriras pas.
1	Ni toi non plus.
1	Ni toi.
1	Il faut que j'aie ici l'âme bien patiente !
1	Au moins, c'est moi, Monsieur.
1	Je suis votre servante,
1	C'est moi.
1	Sans le respect de monsieur que voilà,
1	Je te...
1	ARNOLPHE, recevant un coup d'Peste !
1	Pardon.
1	Voyez ce lourdaud-là !
1	C'est elle aussi, Monsieur...
1	Que tous deux on se taise.
1	Songez à me répondre, et laissons la fadaise.
1	Hé bien, Alain, comment se porte-t-on ici ?
1	Monsieur, nous nous... Monsieur, nous nous por... Dieu merci,
1	Nous nous...
1	Arnolphe ôte le chapeau de dessus la tête d'Qui vous apprend, impertinente bête,
1	À parler devant moi, le chapeau sur la tête ?
1	Vous faites bien, j'ai tort.
1	ARNOLPHE, à Faites descendre À Lorsque je m'en allai, fut-elle triste après ?
1	Triste ! Non.
1	Non !
1	Si fait.
1	Pourquoi donc...
1	Oui, je meure,
1	Elle vous croyait voir de retour à toute heure ;
1	Et nous n'oyions jamais passer devant chez nous,
1	Cheval, âne, ou mulet, qu'elle ne prît pour vous.
1	Agnès, Alain, Georgette, La besogne à la main, c'est un bon témoignage.
1	Hé bien, Agnès, je suis de retour du voyage,
1	En êtes-vous bien aise ?
1	Oui, Monsieur, Dieu merci.
1	Et moi de vous revoir je suis bien aise aussi :
1	Vous vous êtes toujours, comme on voit, bien portée ?
1	Hors les puces, qui m'ont la nuit inquiétée.
1	Ah ! Vous aurez dans peu quelqu'un pour les chasser.
1	Vous me ferez plaisir.
1	Je le puis bien penser.
1	Que faites-vous donc là ?
1	Je me fais des cornettes,
1	Vos chemises de nuit, et vos coiffes sont faites.
1	Ha ! Voilà qui va bien ; allez, montez là-Ne vous ennuyez point, je reviendrai tantôt,
1	Et je vous parlerai d'affaires importantes.
1	Tous étant rentrés.
1	Héroïnes du temps, Mesdames les Savantes,
1	Pousseuses de tendresse et de beaux sentiments,
1	Je défie à la fois tous vos vers, vos romans,
1	Vos lettres, billets doux, toute votre science
1	De valoir cette honnête et pudique ignorance.
1	Horace, Ce n'est point par le bien qu'il faut être ébloui ;
1	Et pourvu que l'honneur soit... Que vois-je ? Est-ce ?... Oui.
1	Je me trompe. Nenni. Si fait. Non, c'est lui-même.
1	Hor...
1	Seigneur Ar...
1	Ah ! Joie extrême !
1	Et depuis quand ici ?
1	Depuis neuf jours.
1	Vraiment ?
1	Je fus d'abord chez vous, mais inutilement.
1	J'étais à la campagne.
1	Oui, depuis deux journées.
1	Ô comme les enfants croissent en peu d'années !
1	J'admire de le voir au point où le voilà,
1	Après que je l'ai vu pas plus grand que cela.
1	Vous voyez.
1	Mais, de grâce, Oronte votre père,
1	Mon bon et cher ami, que j'estime et révère,
1	Que fait-il ? Que dit-il ? Est-il toujours gaillard ?
1	À tout ce qui le touche, il sait que je prends part.
1	Nous ne nous sommes vus depuis quatre ans ensemble.
1	Ni, qui plus est, écrit l'un à l'autre, me semble.
1	Il est, Seigneur Arnolphe, encore plus gai que nous,
1	Et j'avais de sa part une lettre pour vous ;
1	Mais depuis, par une autre il m'apprend sa venue,
1	Et la raison encore ne m'en est pas connue.
1	Savez-vous qui peut être un de vos citoyens,
1	Qui retourne en ces lieux avec beaucoup de biens,
1	Qu'il s'est en quatorze ans acquis dans l'Amérique ?
1	Non. Vous a-t-on point dit comme on le nomme ?
1	Non.
1	Mon père m'en parle, et qu'il est revenu,
1	Comme s'il devait m'être entièrement connu,
1	Et m'écrit qu'en chemin ensemble ils se vont mettre,
1	Pour un fait important que ne dit point sa lettre.
1	J'aurai certainement grande joie à le voir,
1	Et pour le régaler, je ferai mon pouvoir.
1	Après avoir lu la lettre.
1	Il faut pour des amis des lettres moins civiles,
1	Et tous ces compliments sont choses inutiles,
1	Sans qu'il prit le souci de m'en écrire rien,
1	Vous pouvez librement disposer de mon bien.
1	Je suis homme à saisir les gens par leurs paroles,
1	Et j'ai présentement besoin de cent pistoles.
1	Ma foi, c'est m'obliger que d'en user ainsi,
1	Et je me réjouis de les avoir ici.
1	Gardez aussi la bourse.
1	Il faut...
1	Laissons ce style.
1	Hé bien, Comment encore trouvez-vous cette ville ?
1	Nombreuse en citoyens, superbe en bâtiments,
1	Et j'en crois merveilleux les divertissements.
1	Chacun a ses plaisirs qu'il se fait à sa guise :
1	Mais pour ceux que du nom de galants on baptise,
1	Ils ont en ce pays de quoi se contenter,
1	Car les femmes y sont faites à coqueter :
1	On trouve d'humeur douce et la brune et la blonde,
1	Et les maris aussi les plus bénins du monde :
1	C'est un plaisir de prince, et des tours que je vois
1	Je me donne souvent la comédie à moi.
1	Peut-être en avez-vous déjà féru quelqu'une.
1	Vous est-il point encore arrivé de fortune ?
1	Les gens faits comme vous, font plus que les écus,
1	Et vous êtes de taille à faire des cocus.
1	À ne vous rien cacher de la vérité pure,
1	J'ai d'amour en ces lieux eu certaine aventure,
1	Et l'amitié m'oblige à vous en faire part.
1	Bon ! Voici de nouveau quelque conte gaillard,
1	Et ce sera de quoi mettre sur mes tablettes.
1	Mais, de grâce, qu'au moins ces choses soient secrètes.
1	Oh !
1	Vous n'ignorez pas qu'en ces occasions
1	Un secret éventé rompt nos prétentions.
1	Je vous avouerai donc avec pleine franchise
1	Qu'ici d'une beauté mon âme s'est éprise :
1	Mes petits soins d'abord ont eu tant de succès,
1	Que je me suis chez elle ouvert un doux accès ;
1	Et sans trop me vanter ni lui faire une injure,
1	Mes affaires y sont en fort bonne posture.
1	ARNOLPHE, riant.
1	Et c'est ?
1	HORACE, lui montrant le logis d'Un jeune objet qui loge en ce logis,
1	Dont vous voyez d'ici que les murs sont rougis ;
1	Simple, à la vérité, par l'erreur sans seconde
1	D'un homme qui la cache au commerce du monde,
1	Mais qui dans l'ignorance où l'on veut l'asservir,
1	Fait briller des attraits capables de ravir,
1	Un air tout engageant, je ne sais quoi de tendre,
1	Dont il n'est point de coeur qui se puisse défendre :
1	Mais, peut-être, il n'est pas que vous n'ayez bien vu
1	Ce jeune astre d'amour de tant d'attraits pourvu :
1	C'est Agnès qu'on l'appelle.
1	ARNOLPHE, Ah ! Je crève.
1	Pour l'homme,
1	C'est, je crois, de la Zousse ou Souche qu'on le nomme,
1	Je ne me suis pas fort arrêté sur le nom ;
1	Riche, à ce qu'on m'a dit, mais des plus sensés, non,
1	Et l'on m'en a parlé comme d'un ridicule.
1	Le connaissez-vous point ?
1	ARNOLPHE, La fâcheuse pilule !
1	Eh ! Vous ne dites mot.
1	Eh oui, je le connais.
1	C'est un fou, n'est-ce pas ?
1	Eh...
1	Qu'en dites-vous ? Quoi ?
1	Eh ? C'est-à-dire oui ? Jaloux ? À faire rire.
1	Sot ? Je vois qu'il en est ce que l'on m'a pu dire.
1	Enfin l'aimable Agnès a su m'assujettir.
1	C'est un joli bijou, pour ne point vous mentir,
1	Et ce serait péché, qu'une beauté si rare
1	Fût laissée au pouvoir de cet homme bizarre.
1	Pour moi, tous mes efforts, tous mes voeux les plus doux,
1	Vont à m'en rendre maître en dépit du jaloux ;
1	Et l'argent que de vous j'emprunte avec franchise
1	N'est que pour mettre à bout cette juste entreprise.
1	Vous savez mieux que moi, quels que soient nos efforts,
1	Que l'argent est la clef de tous les grands ressorts,
1	Et que ce doux métal qui frappe tant de têtes,
1	En amour, comme en guerre, avance les conquêtes.
1	Vous me semblez chagrin : serait-ce qu'en effet
1	Vous désapprouveriez le dessein que j'ai fait ?
1	Non, c'est que je songeais...
1	Cet entretien vous lasse ;
1	Adieu. J'irai chez vous tantôt vous rendre grâce.
1	Ah ! Faut-il...
1	HORACE, revenant.
1	Derechef, veuillez être discret,
1	Et n'allez pas, de grâce, éventer mon secret.
1	ARNOLPHE, se croyant seul.
1	Que je sens dans mon âme...
1	HORACE, revenant.
1	Et surtout à mon père,
1	Qui s'en ferait peut-être un sujet de colère.
1	ARNOLPHE, croyant qu'il revient encore.
1	Oh ! ... Oh ! Que j'ai souffert durant cet entretien !
1	Jamais trouble d'esprit ne fut égal au mien.
1	Avec quelle imprudence et quelle hâte extrême
1	Il m'est venu conter cette affaire à moi-même !
1	Bien que mon autre nom le tienne dans l'erreur,
1	Étourdi, montra-t-il jamais tant de fureur ?
1	Mais ayant tant souffert, je devais me contraindre
1	Jusques à m'éclaircir de ce que je dois craindre,
1	À pousser jusqu'au bout son caquet indiscret,
1	Et savoir pleinement leur commerce secret.
1	Tâchons à le rejoindre, il n'est pas loin je pense,
1	Tirons-en de ce fait l'entière confidence ;
1	Je tremble du malheur qui m'en peut arriver,
1	Et l'on cherche souvent plus qu'on ne veut trouver.
1	Il m'est, lorsque j'y pense, avantageux sans doute,
1	D'avoir perdu mes pas, et pu manquer sa route :
1	Car enfin, de mon coeur le trouble impérieux
1	N'eût pu se renfermer tout entier à ses yeux,
1	Il eût fait éclater l'ennui qui me dévore,
1	Et je ne voudrais pas qu'il sût ce qu'il ignore.
1	Mais je ne suis pas homme à gober le morceau,
1	Et laisser un champ libre aux voeux du damoiseau,
1	J'en veux rompre le cours, et sans tarder, apprendre
1	Jusqu'où l'intelligence entre eux a pu s'étendre :
1	J'y prends, pour mon honneur, un notable intérêt,
1	Je la regarde en femme, aux termes qu'elle en est,
1	Elle n'a pu faillir, sans me couvrir de honte,
1	Et tout ce qu'elle a fait enfin est sur mon compte.
1	Éloignement fatal ! Voyage malheureux !
1	Frappant à la porte.
1	Arnolphe, Alain, Gorgette.
1	Ah ! Monsieur, cette fois...
1	Paix. Venez là tous deux :
1	Passez là, passez là. Venez là, venez dis-je.
1	Ah ! Vous me faites peur, et tout mon sang se fige.
1	C'est donc ainsi, qu'absent vous m'avez obéi ?
1	Et tous deux, de concert, vous m'avez donc trahi ?
1	Eh ne me mangez pas, Monsieur, je vous conjure.
1	ALAIN, Quelque chien enragé l'a mordu, je m'assure.
1	Ouf ! Je ne puis parler, tant je suis prévenu,
1	Je suffoque, et voudrais me pouvoir mettre nu.
1	Vous avez donc souffert, ô canaille maudite,
1	Qu'un homme soit venu... Tu veux prendre la fuite ?
1	Il faut que sur-le-champ... Si tu bouges... Je veux
1	Que vous me disiez... Euh ? Oui, je veux que tous deux...
1	Quiconque remuera, par la mort, je l'assomme.
1	Comme est-ce que chez moi s'est introduit cet homme ?
1	Eh ! Parlez, dépêchez, vite, promptement, tôt,
1	Sans rêver. Veut-on dire ?
1	ALAIN et Ah, ah.
1	Le coeur me faut.
1	Je meurs.
1	Je suis en eau : prenons un peu d'haleine ;
1	Il faut que je m'évente et que je me promène.
1	Aurais-je deviné quand je l'ai vu petit,
1	Qu'il croîtrait pour cela ? Ciel ! Que mon coeur pâtit !
1	Je pense qu'il vaut mieux que de sa propre bouche
1	Je tire avec douceur l'affaire qui me touche.
1	Tâchons de modérer notre ressentiment.
1	Patience, mon coeur, doucement, doucement.
1	Levez-vous, et rentrant, faites qu'Agnès descende.
1	Arrêtez. Sa surprise en deviendrait moins grande,
1	Du chagrin qui me trouble ils iraient l'avertir ;
1	Et moi-même je veux l'aller faire sortir.
1	Que l'on m'attende ici.
1	Alain, Mon Dieu ! Qu'il est terrible !
1	Ses regards m'ont fait peur, mais une peur horrible,
1	Et jamais je ne vis un plus hideux chrétien.
1	Ce monsieur l'a fâché : je te le disais bien.
1	Mais que diantre est-ce là, qu'avec tant de rudesse
1	Il nous fait au logis garder notre maîtresse ?
1	D'où vient qu'à tout le monde il veut tant la cacher,
1	Et qu'il ne saurait voir personne en approcher ?
1	C'est que cette action le met en jalousie.
1	Mais d'où vient qu'il est pris de cette fantaisie ?
1	Cela vient... Cela vient de ce qu'il est jaloux.
1	Oui ; mais pourquoi l'est-il ? Et pourquoi ce courroux ?
1	C'est que la jalousie... Entends-tu bien, Est une chose... Là... Qui fait qu'on s'inquiète...
1	Et qui chasse les gens d'autour d'une maison.
1	Je m'en vais te bailler une comparaison,
1	Afin de concevoir la chose davantage.
1	Dis-moi, n'est-il pas vrai, quand tu tiens ton potage,
1	Que si quelque affamé venait pour en manger,
1	Tu serais en colère, et voudrais le charger ?
1	Oui, je comprends cela.
1	C'est justement tout comme :
1	La femme est en effet le potage de l'homme ;
1	Et quand un homme voit d'autres hommes parfois,
1	Qui veulent dans sa soupe aller tremper leurs doigts,
1	Il en montre aussitôt une colère extrême.
1	Oui : mais pourquoi chacun n'en fait-il pas de même ?
1	Et que nous en voyons qui paraissent joyeux,
1	Lorsque leurs femmes sont avec les biaux monsieux ?
1	C'est que chacun n'a pas cette amitié goulue
1	Qui n'en veut que pour soi.
1	Si je n'ai la berlue,
1	Je le vois qui revient.
1	Tes yeux sont bons, c'est lui.
1	Vois comme il est chagrin.
1	C'est qu'il a de l'ennui.
1	Alain, Un certain Grec disait à l'empereur Auguste,
1	Comme une instruction utile autant que juste,
1	Que lorsqu'une aventure en colère nous met,
1	Nous devons, avant tout, dire notre alphabet,
1	Afin que dans ce temps la bile se tempère,
1	Et qu'on ne fasse rien que l'on ne doive faire.
1	J'ai suivi sa leçon sur le sujet d'Agnès ;
1	Et je la fais venir en ce lieu tout exprès,
1	Sous prétexte d'y faire un tour de promenade ;
1	Afin que les soupçons de mon esprit malade
1	Puissent sur le discours la mettre adroitement,
1	Et lui sondant le coeur s'éclaircir doucement.
1	Venez, Agnès. Rentrez.
1	Alain, La promenade est belle.
1	Fort belle.
1	Le beau jour !
1	Fort beau.
1	Quelle nouvelle ?
1	Le petit chat est mort.
1	C'est dommage : mais quoi
1	Nous sommes tous mortels, et chacun est pour soi.
1	Lorsque j'étais aux champs, n'a-t-il point fait de pluie ?
1	Non.
1	Vous ennuyait-il ?
1	Jamais je ne m'ennuie.
1	Qu'avez-vous fait encore ces neuf ou dix jours-ci ?
1	Six chemises, je pense, et six coiffes aussi.
1	ARNOLPHE, ayant un peu rêvé.
1	Le monde, chère Agnès, est une étrange chose.
1	Voyez la médisance, et comme chacun cause.
1	Quelques voisins m'ont dit qu'un jeune homme inconnu,
1	Était en mon absence à la maison venu ;
1	Que vous aviez souffert sa vue et ses harangues.
1	Mais je n'ai point pris foi sur ces méchantes langues ;
1	Et j'ai voulu gager que c'était faussement...
1	Mon Dieu, ne gagez pas, vous perdriez vraiment.
1	Quoi ! C'est la vérité qu'un homme...
1	Chose sûre.
1	Il n'a presque bougé de chez nous, je vous jure.
1	ARNOLPHE, Cet aveu qu'elle fait avec sincérité,
1	Me marque pour le moins son ingénuité.
1	Mais il me semble, Agnès, si ma mémoire est bonne,
1	Que j'avais défendu que vous vissiez personne.
1	Oui : mais quand je l'ai vu, vous ignorez pourquoi ;
1	Et vous en auriez fait, sans doute, autant que moi.
1	Peut-être : mais enfin contez-moi cette histoire.
1	Elle est fort étonnante, et difficile à croire.
1	J'étais sur le balcon à travailler au frais :
1	Lorsque je vis passer sous les arbres d'auprès
1	Un jeune homme bien fait, qui rencontrant ma vue,
1	D'une humble révérence aussitôt me salue :
1	Moi, pour ne point manquer à la civilité,
1	Je fis la révérence aussi de mon côté.
1	Soudain, il me refait une autre révérence.
1	Moi, j'en refais de même une autre en diligence ;
1	Et lui d'une troisième aussitôt repartant,
1	D'une troisième aussi j'y repars à l'instant.
1	Il passe, vient, repasse, et toujours de plus belle
1	Me fait à chaque fois révérence nouvelle ;
1	Et moi, qui tous ces tours fixement regardais,
