1	Est-il de petits corps un plus lourd assemblage !
1	Un esprit composé d'atomes plus bourgeois !
1	Et de ce même sang se peut-il que je sois !
1	Je me veux mal de mort d'être de votre race,
1	Et de confusion j'abandonne la place.
1	Avez-vous à lâcher encore quelque trait ?
1	Moi ? Non. Ne parlons plus de querelle, c'est fait ;
1	Discourons d'autre affaire. À votre fille aînée
1	On voit quelque dégoût pour les noeuds d'hyménée ;
1	C'est une philosophe enfin, je n'en dis rien,
1	Elle est bien gouvernée, et vous faites fort bien.
1	Mais de toute autre humeur se trouve sa cadette,
1	Et je crois qu'il est bon de pourvoir 
1	De choisir un mari...
1	C'est à quoi j'ai songé,
1	Et je veux vous ouvrir l'intention que j'ai.
1	Ce Monsieur dont on nous fait un crime,
1	Et qui n'a pas l'honneur d'être dans votre estime,
1	Est celui que je prends pour l'époux qu'il lui faut,
1	Et je sais mieux que vous juger de ce qu'il vaut ;
1	La contestation est ici superflue,
1	Et de tout point chez moi l'affaire est résolue.
1	Au moins ne dites mot du choix de cet époux,
1	Je veux à votre fille en parler avant vous.
1	J'ai des raisons à faire approuver ma conduite,
1	Et je connaîtrai bien si vous l'aurez instruite.
1	Hé bien ? La femme sort, mon frère, et je vois bien
1	Que vous venez d'avoir ensemble un entretien.
1	Oui.
1	Quel est le succès ? Aurons-nous ?
1	A-t-elle consenti ? L'affaire est-elle faite ?
1	Pas tout à fait encor.
1	Refuse-t-elle ?
1	Non.
1	Est-ce qu'elle balance ?
1	En aucune façon.
1	Quoi donc ?
1	C'est que pour gendre elle m'offre un autre homme.
1	Un autre homme pour gendre !
1	Un autre.
1	Qui se nomme ?
1	Monsieur 
1	Quoi ? Ce Monsieur ..
1	Oui, qui parle toujours de vers et de latin.
1	Vous l'avez accepté ?
1	Moi, point, à Dieu ne plaise.
1	Qu'avez-vous répondu ?
1	Rien ; et je suis bien aise
1	De n'avoir point parlé, pour ne m'engager pas !
1	La raison est fort belle, et c'est faire un grand pas.
1	Avez-vous su du moins lui proposer ?
1	Non : car comme j'ai vu qu'on parlait d'autre gendre,
1	J'ai cru qu'il était mieux de ne m'avancer point.
1	Certes votre prudence est rare au dernier point !
1	N'avez-vous point de honte avec votre mollesse ?
1	Et se peut-il qu'un homme ait assez de faiblesse
1	Pour laisser à sa femme un pouvoir absolu,
1	Et n'oser attaquer ce qu'elle a résolu ?
1	Mon Dieu, vous en parlez, mon frère, bien à l'aise,
1	Et vous ne savez pas comme le bruit me pèse.
1	J'aime fort le repos, la paix, et la douceur,
1	Et ma femme est terrible avecque son humeur.
1	Du nom de philosophe elle fait grand mystère,
1	Mais elle n'en est pas pour cela moins colère ;
1	Et sa morale, faite à mépriser le bien,
1	Sur l'aigreur de sa bile opère comme rien.
1	Pour peu que l'on s'oppose à ce que veut sa tête,
1	On en a pour huit jours d'effroyable tempête.
1	Elle me fait trembler dès qu'elle prend son ton.
1	Je ne sais où me mettre, et c'est un vrai dragon ;
1	Et cependant, avec toute sa diablerie,
1	Il faut que je l'appelle, et « mon coeur », et « ma mie ».
1	Allez, c'est se moquer. Votre femme, entre nous,
1	Est par vos lâchetés souveraine sur vous.
1	Son pouvoir n'est fondé que sur votre faiblesse.
1	C'est de vous qu'elle prend le titre de maîtresse.
1	Vous-même à ses hauteurs vous vous abandonnez,
1	Et vous faites mener en bête par le nez.
1	Quoi, vous ne pouvez pas, voyant comme on vous nomme,
1	Vous résoudre une fois à vouloir être un homme ?
1	À faire condescendre une femme à vos voeux,
1	Et prendre assez de coeur pour dire un : « Je le veux » ?
1	Vous laisserez sans honte immoler votre fille
1	Aux folles visions qui tiennent la famille,
1	Et de tout votre bien revêtir un nigaud,
1	Pour six mots de latin qu'il leur fait sonner haut ?
1	Un pédant qu'à tous coups votre femme apostrophe
1	Du nom de bel esprit, et de grand philosophe,
1	D'homme qu'en vers galants jamais on n'égala,
1	Et qui n'est, comme on sait, rien moins que tout cela ?
1	Allez, encore un coup, c'est une moquerie,
1	Et votre lâcheté mérite qu'on en rie.
1	Oui, vous avez raison, et je vois que j'ai tort.
1	Allons, il faut enfin montrer un coeur plus fort,
1	Mon frère.
1	C'est bien dit.
1	C'est une chose infâme,
1	Que d'être si soumis au pouvoir d'une femme.
1	Fort bien.
1	De ma douceur elle a trop profité.
1	Il est vrai.
1	Trop joui de ma facilité.
1	Sans doute.
1	Et je lui veux faire aujourd'hui connaître
1	Que ma fille est ma fille, et que j'en suis le maître,
1	Pour lui prendre un mari qui soit selon mes voeux.
1	Vous voilà raisonnable, et comme je vous veux.
1	Vous êtes pour  et savez sa demeure ;
1	Faites-le-moi venir, mon frère, tout à l'heure.
1	J'y cours tout de ce pas.
1	C'est souffrir trop longtemps,
1	Et je m'en vais être homme à la barbe des gens.
1	L'Épine.
1	Ah ! Mettons-nous ici, pour écouter à l'aise
1	Ces vers que mot à mot il est besoin qu'on pèse.
1	Je brûle de les voir.
1	Et l'on s'en meurt chez nous.
1	Ce sont charmes pour moi que ce qui part de vous.
1	Ce m'est une douceur à nulle autre pareille.
1	Ce sont repas friands qu'on donne à mon oreille.
1	Ne faites point languir de si pressants désirs.
1	Dépêchez.
1	Faites tôt, et hâtez nos plaisirs.
1	À notre impatience offrez votre épigramme.
1	Hélas ! C'est un enfant tout nouveau-né, Madame.
1	Son sort assurément a lieu de vous toucher,
1	Et c'est dans votre cour, que j'en viens d'accoucher.
1	Pour me le rendre cher, il suffit de son père.
1	Votre approbation lui peut servir de mère.
1	Qu'il a d'esprit !
1	L'Épine.
1	Holà, pourquoi donc fuyez-vous ?
1	C'est de peur de troubler un entretien si doux.
1	Approchez, et venez de toutes vos oreilles,
1	Prendre part au plaisir d'entendre des merveilles.
1	Je sais peu les beautés de tout ce qu'on écrit,
1	Et ce n'est pas mon fait que les choses d'esprit.
1	Il n'importe ; aussi bien ai-je à vous dire ensuite
1	Un secret dont il faut que vous soyez instruite.
1	Les sciences n'ont rien qui vous puisse enflammer,
1	Et vous ne vous piquez que de savoir charmer.
1	Aussi peu l'un que l'autre, et je n'ai nulle envie...
1	Ah songeons à l'enfant nouveau-né, je vous prie.
1	à l'Épine.
1	Allons, petit garçon, vite, de quoi s'asseoir.
1	Le laquais tombe avec sa chaise.
1	Voyez l'impertinent ! Est ce que l'on doit choir,
1	Après avoir appris l'équilibre des choses ?
1	De ta chute, Ignorant, ne vois-tu pas les causes,
1	Et qu'elle vient d'avoir du point fixe écarté,
1	Ce que nous appelons centre de gravité ?
1	L'ÉPINE.
1	Je m'en suis aperçu, Madame, étant par terre.
1	Le lourdaud !
1	Bien lui prend de n'être pas de verre.
1	Ah de l'esprit partout !
1	Cela ne tarit pas.
1	Servez-nous promptement votre aimable repas.
1	Pour cette grande faim qu'à mes yeux on expose,
1	Un plat seul de huit vers me semble peu de chose,
1	Et je pense qu'ici je ne ferai pas mal
1	De joindre à l'épigramme, ou bien au madrigal,
1	Le ragoût d'un sonnet, qui chez une princesse
1	A passé pour avoir quelque délicatesse.
1	Il est de sel attique assaisonné partout,
1	Et vous le trouverez, je crois, d'assez bon goût.
1	Ah je n'en doute point.
1	Donnons vite audience.
1	à chaque fois qu'il veut lire elle l'interrompt.
1	Je sens d'aise mon coeur tressaillir par avance.
1	J'aime la poésie avec entêtement,
1	Et surtout quand les vers sont tournés galamment.
1	Si nous parlons toujours, il ne pourra rien dire.
1	So ...
1	Silence, ma nièce.
1	Ah laissez-le donc lire.
1	Sonnet à la Princesse Uranie sur sa fièvre
1	<poem type="quatrain">
1	<lg>
1	Votre prudence est endormie,
1	De traiter magnifiquement,
1	Et de loger superbement
1	Votre plus cruelle ennemie.
1	</lg>
1	</poem>
1	Ah le joli début !
1	Qu'il a le tour galant !
1	Lui seul des vers aisés possède le talent !
1	À « prudence endormie » il faut rendre les armes.
1	« Loger son ennemie » est pour moi plein de charmes.
1	J'aime « superbement et magnifiquement » ;
1	Ces deux adverbes joints font admirablement.
1	Prêtons l'oreille au reste.
1	<poem type="quatrain">
1	<lg>
1	Votre prudence est endormie,
1	De traiter magnifiquement,
1	Et de loger superbement
1	Votre plus cruelle ennemie.
1	</lg>
1	</poem>
1	« Prudence endormie » !
1	« Loger son ennemie » !
1	« Superbement et magnifiquement » !
1	<poem type="quatrain">
1	<lg>
1	Faites-la sortir, quoi qu'on die,
1	De votre riche appartement,
1	Où cette ingrate insolemment
1	Attaque votre belle vie.
1	</lg>
1	</poem>
1	Ah tout doux, laissez-moi, de grâce, respirer.
1	Donnez-nous, s'il vous plaît, le loisir d'admirer.
1	On se sent à ces vers, jusques au fond de l'âme,
1	Couler je-ne-sais-quoi qui fait que l'on se pâme.
1	<poem type="distique">
1	<lg>
1	Faites-la sortir, quoi qu'on die,
1	De votre riche appartement.
1	</lg>
1	</poem>
1	Que riche « appartement » est là joliment dit !
1	Et que la métaphore est mise avec esprit !
1	<poem type="citation">
1	<lg>
1	Faites-la sortir, quoi qu'on die.
1	</lg>
1	</poem>
1	Ah ! Que ce « quoi qu'on die » est d'un goût admirable !
1	C'est, à mon sentiment, un endroit impayable.
1	De « quoi qu'on die » aussi mon coeur est amoureux.
1	Je suis de votre avis, « quoi qu'on die » est heureux.
1	Je voudrais l'avoir fait.
1	Il vaut toute une pièce.
1	Mais en comprend-on bien, comme moi, la finesse ?
1	et 
1	Oh, oh !
1	« Faites-la sortir, quoi qu'on die. »
1	Que de la fièvre, on prenne ici les intérêts,
1	N'ayez aucun égard, moquez-vous des caquets.
1	<poem type="distique">
1	<lg>
1	Faites-la sortir, quoi qu'on die.
1	Quoi qu'on die, quoi qu'on die.
1	</lg>
1	</poem>
1	Ce « quoi qu'on die » en dit beaucoup plus qu'il ne semble.
1	Je ne sais pas, pour moi, si chacun me ressemble ;
1	Mais j'entends là-dessous un million de mots.
1	Il est vrai qu'il dit plus de choses qu'il n'est gros.
1	Mais quand vous avez fait ce charmant « quoi qu'on die »,
1	Avez-vous compris, vous, toute son énergie ?
1	Songiez-vous bien vous-même à tout ce qu'il nous dit,
1	Et pensiez-vous alors y mettre tant d'esprit ?
1	Hay, hay.
1	J'ai fort aussi l'« ingrate » dans la tête,
1	Cette ingrate de fièvre, injuste, malhonnête,
1	Qui traite mal les gens qui la logent chez eux.
1	Enfin les quatrains sont admirables tous deux.
1	Venons-en promptement aux tiercets, je vous prie.
1	Ah, s'il vous plaît, encore une fois « quoi qu'on die ».
1	<poem type="citation">
1	<lg>
1	Faites-la sortir, quoi qu'on die,
1	</lg>
1	</poem>
1	et 
1	« Quoi qu'on die » !
1	<poem type="citation">
1	<lg>
1	De votre riche appartement,
1	</lg>
1	</poem>
1	et 
1	« Riche appartement » !
1	<poem type="citation">
1	<lg>
1	Où cette ingrate insolemment
1	</lg>
1	</poem>
1	et 
1	« Cette ingratec de fièvre ?
1	<poem type="citation">
1	<lg>
1	Attaque votre belle vie.
1	</lg>
1	</poem>
1	« Votre belle vie ! »
1	et 
1	Ah !
1	<poem type="citation">
1	<lg>
1	Quoi ? Sans respecter votre rang,
1	Elle se prend à votre sang,
1	</lg>
1	</poem>
1	et 
1	Ah !
1	<poem type="citation">
1	<lg>
1	Et nuit et jour vous fait outrage ?
1	</lg>
1	<lg>
1	Si vous la conduisez aux bains,
1	Sans la marchander davantage,
1	Noyez-la de vos propres mains.
1	</lg>
1	</poem>
1	On n'en peut plus.
1	On pâme.
1	On se meurt de plaisir.
1	De mille doux frissons vous vous sentez saisir.
1	« Si vous la conduisez aux bains, »
1	« Sans la marchander davantage, »
1	« Noyez-la de vos propres mains :
1	De vos propres mains, là, noyez-la dans les bains. »
1	Chaque pas dans vos vers rencontre un trait charmant.
1	Partout on s'y promène avec ravissement.
1	On n'y saurait marcher que sur de belles choses.
1	Ce sont petits chemins tout parsemés de roses.
1	Le sonnet donc vous semble...
1	Admirable, nouveau,
1	Et personne jamais n'a rien fait de si beau.
1	Quoi, sans émotion pendant cette lecture ?
1	Vous faites-là, ma nièce, une étrange figure !
1	Chacun fait ici-bas la figure qu'il peut,
1	Ma tante ; et Bel-Esprit, il ne l'est pas qui veut.
1	Peut-être que mes vers importunent Madame.
1	Point, je n'écoute pas.
1	Ah ? Voyons l'épigramme.
1	SUR UN CARROSSE de couleur amarante, donné à une dame de ses amies.
1	Ces titres ont toujours quelque chose de rare.
1	À cent beaux traits d'esprit leur nouveauté prépare.
1	<poem type="vers unique">
1	<lg>
1	L'Amour si chèrement m'a vendu son lien,
1	</lg>
1	</poem>
1	et 
1	Ah !
1	<poem type="vers">
1	<lg>
1	Qu'il m'en coûte déjà la moitié de mon bien.
1	Et quand tu vois ce beau carrosse
1	Où tant d'or se relève en bosse,
1	Qu'il étonne tout le pays,
1	Et fait pompeusement triompher ma Laïs,
1	</lg>
1	</poem>
1	Ah « ma Laïs » ! Voilà de l'érudition.
1	L'enveloppe est jolie, et vaut un million.
1	<poem type="vers">
1	<lg>
1	Et quand tu vois ce beau carrosse,
1	Où tant d'or se relève en bosse,
1	Qu'il étonne tout le pays,
1	Et fait pompeusement triompher ma Laïs,
1	Ne dis plus qu'il est amarante :
1	Dis plutôt qu'il est de ma rente.
1	</lg>
1	</poem>
1	Oh, oh, oh ! Celui-là ne s'attend point du tout.
1	On n'a que lui qui puisse écrire de ce goût.
1	« Ne dis plus qu'il est amarante :
1	Dis plutôt qu'il est de ma rente. »
1	Voilà qui se décline : « ma rente, de ma rente, à ma rente. »
1	.............
1	Je ne sais, du moment que je vous ai connu,
1	Si sur votre sujet j'ai l'esprit prévenu,
1	Mais j'admire partout vos vers et votre prose.
1	Si vous vouliez de vous nous montrer quelque chose,
1	À notre tour aussi nous pourrions admirer.
1	Je n'ai rien fait en vers, mais j'ai lieu d'espérer
1	Que je pourrai bientôt vous montrer, en amie,
1	Huit chapitres du plan de notre Académie.
1	Platon s'est au projet simplement arrêté,
1	Quand de sa République il a fait le traité ;
1	Mais à l'effet entier je veux pousser l'idée
1	Que j'ai sur le papier en prose accommodée,
1	Car enfin je me sens un étrange dépit
1	Du tort que l'on nous fait du côté de l'esprit,
1	Et je veux nous venger toutes tant que nous sommes
1	De cette indigne classe où nous rangent les hommes ;
1	De borner nos talents à des futilités,
1	Et nous fermer la porte aux sublimes clartés.
1	C'est faire à notre sexe une trop grande offense,
1	De n'étendre l'effort de notre intelligence, 
1	Qu'à juger d'une jupe et de l'air d'un manteau,
1	Ou des beautés d'un point, ou d'un brocart nouveau.
1	Il faut se relever de ce honteux partage,
1	Et mettre hautement notre esprit hors de page.
1	Pour les dames on sait mon respect en tous lieux,
1	Et si je rends hommage aux brillants de leurs yeux,
1	De leur esprit aussi j'honore les lumières.
1	Le sexe aussi vous rend justice en ces matières ;
1	Mais nous voulons montrer à de certains esprits,
1	Dont l'orgueilleux savoir nous traite avec mépris,
1	Que de science aussi les femmes sont meublées,
1	Qu'on peut faire comme eux de doctes assemblées,
1	Conduites en cela par des ordres meilleurs,
1	Qu'on y veut réunir ce qu'on sépare ailleurs,
1	Mêler le beau langage et les hautes sciences ;
1	Découvrir la nature en mille expériences ;
1	Et sur les questions qu'on pourra proposer,
1	Faire entrer chaque secte, et n'en point épouser.
1	Je m'attache pour l'ordre au péripatétisme.
1	Pour les abstractions, j'aime le platonisme.
1	Épicure me plaît, et ses dogmes sont forts.
1	Je m'accommode assez pour moi des petits corps ;
1	Mais le vuide à souffrir me semble difficile,
1	Et je goûte bien mieux la matière subtile.
1	Descartes pour l'aimant donne fort dans mon sens.
1	J'aime ses tourbillons.
1	Moi, ses mondes tombants.
1	Il me tarde de voir notre assemblée ouverte,
1	Et de nous signaler par quelque découverte.
1	On en attend beaucoup de vos vives clartés,
1	Et pour vous la nature a peu d'obscurités.
1	Pour moi, sans me flatter, j'en ai déjà fait une,
1	Et j'ai vu clairement des hommes dans la Lune.
1	Je n'ai point encor vu d'hommes, comme je crois,
1	Mais j'ai vu des clochers tout comme je vous vois.
1	Nous approfondirons ainsi que la physique,
1	Grammaire, Histoire, Vers, Morale et Politique,
1	La morale a des traits dont mon coeur est épris,
1	Et c'était autrefois l'amour des grands esprits ;
1	Mais aux Stoïciens je donne l'avantage,
1	Et je ne trouve rien de si beau que leur Sage.
1	Pour la langue, on verra dans peu nos règlements,
1	Et nous y prétendons faire des remuements.
1	Par une antipathie ou juste, ou naturelle,
1	Nous avons pris chacune une haine mortelle
1	Pour un nombre de mots, soit ou verbes ou noms,
1	Que mutuellement nous nous abandonnons ;
1	Contre eux nous préparons de mortelles sentences,
1	Et nous devons ouvrir nos doctes conférences
1	Par les proscriptions de tous ces mots divers
1	Dont nous voulons purger et la prose et les vers.
1	Mais le plus beau projet de notre académie,
1	Une entreprise noble, et dont je suis ravie ;
1	Un dessein plein de gloire, et qui sera vanté
1	Chez tous les beaux esprits de la postérité,
1	C'est le retranchement de ces syllabes sales,
1	Qui dans les plus beaux mots produisent des scandales ;
1	Ces jouets éternels des sots de tous les temps ;
1	Ces fades lieux communs de nos méchants plaisants ;
1	Ces sources d'un amas d'équivoques infâmes,
1	Dont on vient faire insulte à la pudeur des femmes.
1	Voilà certainement d'admirables projets !
1	Vous verrez nos statuts, quand ils seront tous faits.
1	Ils ne sauraient manquer d'être tous beaux et sages.
1	Nous serons par nos lois les juges des ouvrages.
1	Par nos lois, prose et vers, tout nous sera soumis,
1	Nul n'aura de l'esprit, hors nous et nos amis ;
1	Nous chercherons partout à trouver à redire,
1	Et ne verrons que nous qui sache bien écrire.
1	L'Épine,      Vadius.
1	L'ÉPINE.
1	Monsieur, un homme est là qui veut parler à vous,
1	Il est vêtu de noir, et parle d'un ton doux.
1	C'est cet ami savant qui m'a fait tant d'instance
1	De lui donner l'honneur de votre connaissance.
1	Pour le faire venir, vous avez tout crédit.
1	Faisons bien les honneurs au moins de notre esprit.
1	Holà. Je vous ai dit en paroles bien claires,
1	Que j'ai besoin de vous.
1	Mais pour quelles affaires ?
1	Venez, on va dans peu vous les faire savoir.
1	Voici l'homme qui meurt du désir de vous voir.
1	En vous le produisant, je ne crains point le blâme
1	D'avoir admis chez vous un profane, Madame :
1	Il peut tenir son coin parmi de beaux esprits.
1	La main qui le présente, en dit assez le prix.
1	Il a des vieux auteurs la pleine intelligence,
1	Et sait du Grec, Madame, autant qu'homme de France.
1	Du Grec, ô Ciel ! Du Grec ! Il sait du Grec, ma soeur !
1	Ah, ma nièce, du Grec !
1	Du Grec ! Quelle douceur !
1	Quoi, Monsieur sait du Grec ? Ah permettez, de grâce,
1	Que pour l'amour du Grec, Monsieur, on vous embrasse,
1	Il les baise toutes, jusques à  qui le refuse.
1	Excusez-moi, Monsieur, je n'entends pas le grec.
1	J'ai pour les livres grecs un merveilleux respect.
1	VADIUS.
1	Je crains d'être fâcheux, par l'ardeur qui m'engage
1	À vous rendre aujourd'hui, Madame, mon hommage,
1	Et j'aurai pu troubler quelque docte entretien.
1	Monsieur, avec du Grec on ne peut gâter rien.
1	Au reste il fait merveille en vers ainsi qu'en prose,
1	Et pourrait, s'il voulait, vous montrer quelque chose.
1	VADIUS.
1	Le défaut des auteurs dans leurs productions,
1	C'est d'en tyranniser les conversations ;
1	D'être au Palais, au Cours, aux Ruelles, aux Tables,
1	De leurs vers fatigants lecteurs infatigables.
1	Pour moi, je ne vois rien de plus sot à mon sens,
1	Qu'un auteur qui partout va gueuser des encens ;
1	Qui des premiers-venus saisissant les oreilles,
1	En fait le plus souvent les martyrs de ses veilles.
1	On ne m'a jamais vu ce fol entêtement,
1	Et d'un Grec là-dessus je suis le sentiment,
1	Qui, par un dogme exprès défend à tous ses sages
1	L'indigne empressement de lire leurs ouvrages.
1	Voici de petits vers pour de jeunes amants,
1	Sur quoi je voudrais bien avoir vos sentiments.
1	Vos vers ont des beautés que n'ont point tous les autres.
1	VADIUS.
1	Les Grâces et Vénus règnent dans tous les vôtres.
1	Vous avez le tour libre, et le beau choix des mots.
1	VADIUS.
1	On voit partout chez vous l'ithos et le pathos.
1	Nous avons vu de vous des églogues d'un style
1	Qui passe en doux attraits Théocrite et Virgile.
1	VADIUS.
1	Vos odes ont un air noble, galant et doux,
1	Qui laisse de bien loin votre Horace après vous.
1	Est-il rien d'amoureux comme vos chansonnettes ?
1	VADIUS.
1	Peut-on voir rien d'égal aux sonnets que vous faites ?
1	Rien qui soit plus charmant que vos petits rondeaux ?
1	VADIUS.
1	Rien de si plein d'esprit que tous vos madrigaux ?
1	Aux ballades surtout vous êtes admirable.
1	VADIUS.
1	Et dans les bouts-rimés je vous trouve adorable.
1	Si la France pouvait connaître votre prix.
1	VADIUS.
1	Si le siècle rendait justice aux beaux esprits.
1	En carrosse doré vous iriez par les rues.
1	VADIUS.
1	On verrait le public vous dresser des statues.
1	Hom. C'est une ballade, et je veux que tout net
1	Vous m'en...
1	Avez-vous vu certain petit sonnet
1	Sur la fièvre qui tient la princesse Uranie ?
1	VADIUS.
1	Oui, hier il me fut lu dans une compagnie.
1	Vous en savez l'auteur ?
1	VADIUS.
1	Non ; mais je sais fort bien
1	Qu'à ne le point flatter son sonnet ne vaut rien.
1	Beaucoup de gens pourtant le trouvent admirable.
1	VADIUS.
1	Cela n'empêche pas qu'il ne soit misérable ;
1	Et si vous l'avez vu, vous serez de mon goût.
1	Je sais que là-dessus je n'en suis point du tout,
1	Et que d'un tel sonnet peu de gens sont capables.
1	VADIUS.
1	Me préserve le ciel d'en faire de semblables !
1	Je soutiens qu'on ne peut en faire de meilleur ;
1	Et ma grande raison, c'est que j'en suis l'auteur.
1	VADIUS.
1	Vous ?
1	Moi.
1	VADIUS.
1	Je ne sais donc comment se fit l'affaire.
1	C'est qu'on fut malheureux, de ne pouvoir vous plaire.
1	VADIUS.
1	Il faut qu'en écoutant j'aie eu l'esprit distrait,
1	Ou bien que le lecteur m'ait gâté le sonnet.
1	Mais laissons ce discours, et voyons ma ballade.
1	La ballade, à mon goût, est une chose fade.
1	Ce n'en est plus la mode ; elle sent son vieux temps.
1	VADIUS.
1	La ballade pourtant charme beaucoup de gens.
1	Cela n'empêche pas qu'elle ne me déplaise.
1	VADIUS.
1	Elle n'en reste pas pour cela plus mauvaise.
1	Elle a pour les pédants de merveilleux appas.
1	VADIUS.
1	Cependant nous voyons qu'elle ne vous plaît pas.
1	Vous donnez sottement vos qualités aux autres.
1	VADIUS.
1	Fort impertinemment vous me jetez les vôtres.
1	Allez, petit grimaud, barbouilleur de papier.
1	VADIUS.
1	Allez, rimeur de balle, opprobre du métier.
1	Allez, fripier d'écrits, impudent plagiaire.
1	VADIUS.
1	Allez, cuistre...
1	Eh, Messieurs, que prétendez-vous faire ?
1	Va, va restituer tous les honteux larcins
1	Que réclament sur toi les Grecs et les Latins.
1	VADIUS.
1	Va, va-t'en faire amende honorable au Parnasse,
1	D'avoir fait à tes vers estropier Souviens-toi de ton livre, et de son peu de bruit.
1	VADIUS.
1	Et toi, de ton libraire à l'hôpital réduit.
1	Ma gloire est établie, en vain tu la déchires.
1	VADIUS.
1	Oui, oui, je te renvoie à l'auteur des Satires.
1	Je t'y renvoie aussi.
1	VADIUS.
1	J'ai le contentement,
1	Qu'on voit qu'il m'a traité plus honorablement.
1	Il me donne en passant une atteinte légère
1	Parmi plusieurs auteurs qu'au Palais on révère ;
1	Mais jamais dans ses vers il ne te laisse en paix,
1	Et l'on t'y voit partout être en butte à ses traits.
1	C'est par là que j'y tiens un rang plus honorable.
1	Il te met dans la foule ainsi qu'un misérable,
1	Il croit que c'est assez d'un coup pour t'accabler,
1	Et ne t'a jamais fait l'honneur de redoubler :
1	Mais il m'attaque à part comme un noble adversaire
1	Sur qui tout son effort lui semble nécessaire ;
1	Et ses coups contre moi redoublés en tous lieux,
1	Montrent qu'il ne se croit jamais victorieux.
1	VADIUS.
1	Ma plume t'apprendra quel homme je puis être.
1	Et la mienne saura te faire voir ton maître.
1	VADIUS.
1	Je te défie en vers, prose, Grec, et Latin.
1	Hé bien, nous nous verrons seul à seul chez Barbin.
1	À mon emportement ne donnez aucun blâme ;
1	C'est votre jugement que je défends, Madame,
1	Dans le sonnet qu'il a l'audace d'attaquer.
1	À vous remettre bien je me veux appliquer.
1	Mais parlons d'autre affaire. Approchez, 
1	Depuis assez longtemps mon âme s'inquiète
1	De ce qu'aucun esprit en vous ne se fait voir,
1	Mais je trouve un moyen de vous en faire avoir.
1	C'est prendre un soin pour moi qui n'est pas nécessaire,
1	Les doctes entretiens ne sont point mon affaire.
1	J'aime à vivre aisément, et dans tout ce qu'on dit
1	Il faut se trop peiner, pour avoir de l'esprit.
1	C'est une ambition que je n'ai point en tête.
1	Je me trouve fort bien, ma mère, d'être bête,
1	Et j'aime mieux n'avoir que de communs propos,
1	Que de me tourmenter pour dire de beaux mots.
1	Oui, mais j'y suis blessée, et ce n'est pas mon conte
1	De souffrir dans mon sang une pareille honte.
1	La beauté du visage est un frêle ornement,
1	Une fleur passagère, un éclat d'un moment,
1	Et qui n'est attaché qu'à la simple épiderme ;
1	Mais celle de l'esprit est inhérente et ferme.
1	J'ai donc cherché longtemps un biais de vous donner
1	La beauté que les ans ne peuvent moissonner,
1	De faire entrer chez vous le désir des sciences,
1	De vous insinuer les belles connaissances ;
1	Et la pensée enfin où mes voeux ont souscrit,
1	C'est d'attacher à vous un homme plein d'esprit,
1	Et cet homme est Monsieur que je vous détermine
1	À voir comme l'époux que mon choix vous destine.
1	Moi, ma mère ?
1	Oui, vous. Faites la sotte un peu.
1	Je vous entends. Vos yeux demandent mon aveu,
1	Pour engager ailleurs un coeur que je possède.
1	Allez, je le veux bien. À ce noeud je vous cède,
1	C'est un hymen qui fait votre établissement.
1	Je ne sais que vous dire en mon ravissement,
1	Madame, et cet hymen dont je vois qu'on m'honore
1	Me met...
1	Tout beau, Monsieur, il n'est pas fait encore
1	Ne vous pressez pas tant.
1	Comme vous répondez !
1	Savez-vous bien que si... Suffit, vous m'entendez.
1	Elle se rendra sage ; allons, laissons-la faire.
