1	Mon gendre, que vous devez être ravi, et que cette aventure est pour vous pleine de douceurs ! 
1	Vous aviez un juste sujet de vous alarmer, mais vos soupçons se trouvent dissipés le plus avantageusement du monde.
1	Sans doute, notre gendre, et vous devez maintenant être le plus content des hommes.
1	Assurément. 
1	Voilà une femme celle-là. 
1	Vous êtes trop heureux de l'avoir, et vous devriez baiser les pas où elle passe.
1	Euh ! 
1	Traîtresse !
1	Qu'est-ce, mon gendre ? 
1	Que ne remerciez-vous un peu votre femme de l'amitié que vous voyez qu'elle montre pour vous ?
1	Non, non, mon père, il n'est pas nécessaire. 
1	Il ne m'a aucune obligation de ce qu'il vient de voir, et tout ce que j'en fais n'est que pour l'amour de moi-même.
1	Où allez-vous, ma fille ?
1	Je me retire, mon père, pour ne me voir point obligée à recevoir ses compliments.
1	Elle a raison d'être en colère. 
1	C'est une femme qui mérite d'être adorée, et vous ne la traitez pas comme vous devriez.
1	Scélérate !
1	C'est un petit ressentiment de l'affaire de tantôt, et cela se passera avec un peu de caresse que vous lui ferez. 
1	Adieu, mon gendre, vous voilà en état de ne vous plus inquiéter. 
1	Allez-vous-en faire la paix ensemble, et tâchez de l'apaiser par des excuses de votre emportement.
1	Vous devez considérer que c'est une jeune fille élevée à la vertu, et qui n'est point accoutumée à se voir soupçonnée d'aucune vilaine action. 
1	Adieu. 
1	Je suis ravie de voir vos désordres finis et des transports de joie que vous doit donner sa conduite.
1	Je ne dis mot. 
1	Car je ne gagnerais rien à parler, et jamais il ne s'est rien vu d'égal à ma disgrâce. 
1	Oui, j'admire mon malheur, et la subtile adresse de ma carogne de femme pour se donner toujours raison, et me faire avoir tort. 
1	Est-il possible que toujours j'aurai du dessous avec elle, que les apparences toujours tourneront contre moi, et que je ne parviendrai point à convaincre mon effrontée ? 
1	Ô Ciel ! 
1	Seconde mes desseins, et m'accorde la grâce de faire voir aux gens que l'on me déshonore.
1	La nuit est avancée, et j'ai peur qu'il ne soit trop tard. 
1	Je ne vois point à me conduire. 
1	Lubin !
1	Monsieur ?
1	Est-ce par ici ?
1	Je pense que oui. 
1	Morgué voilà une sotte nuit, d'être si noire que cela.
1	Elle a tort assurément. 
1	Mais si d'un côté elle nous empêche de voir, elle empêche de l'autre que nous ne soyons vus.
1	Vous avez raison, elle n'a pas tant de tort. 
1	Je voudrais bien savoir, Monsieur, vous qui êtes savant, pourquoi il ne fait point jour la nuit.
1	C'est une grande question, et qui est difficile. 
1	Tu es curieux, Lubin.
1	Oui. 
1	Si j'avais étudié, j'aurais été songer à des choses où on n'a jamais songé.
1	Je le crois. 
1	Tu as la mine d'avoir l'esprit subtil et pénétrant.
1	Cela est vrai. 
1	Tenez, j'explique du latin, quoique jamais je ne l'aie appris, et voyant autre jour écrit sur une grande porte collégium, je devinai que cela voulait dire collège.
1	Cela est admirable ! 
1	Tu sais donc lire, Lubin ?
1	Oui je sais lire la lettre moulée, mais je n'ai jamais su apprendre à lire l'écriture.
1	Nous voici contre la maison. 
1	C'est le signal que m'a donné 
1	Par ma foi c'est une fille qui vaut de l'argent, et je l'aime de tout mon coeur.
1	Aussi t'ai-je amené avec moi pour l'entretenir.
1	Monsieur, je vous suis...
1	Chut.
1	J'entends quelque bruit.
1	Hé bien ?
1	Laisse la porte entr'ouverte.
1	Voilà qui est fait.
1	Ce sont elles. 
1	St.
1	St.
1	St.
1	St.
1	à 
1	Madame.
1	à Lubin.
1	Quoi ?
1	LUBIN, à 
1	Qu'est-ce ?
1	à 
1	Ah ! 
1	Madame, que j'ai de joie !
1	LUBIN, à 
1	ma pauvre 
1	à 
1	Doucement, Monsieur.
1	à Lubin.
1	Tout beau, Lubin.
1	Est-ce toi, ?
1	Oui.
1	Est-ce vous, Madame ?
1	Oui.
1	Vous avez pris l'une pour l'autre.
1	Ma foi, la nuit, on n'y voit goutte.
1	Est-ce pas vous, ?
1	Oui, Madame !
1	Mon mari ronfle comme il faut, et j'ai pris ce temps pour nous entretenir ici.
1	Cherchons quelque lieu pour nous asseoir.
1	C'est fort bien avisé.
1	Ils vont s'asseoir au fond du théâtre.
1	où est-ce que tu es ?
1	J'ai entendu descendre ma femme, et je me suis vite habillé pour descendre après elle. 
1	Où peut-elle être allée ? 
1	Serait-elle sortie ?
1	Il prend pour 
1	Où es-tu donc, ? 
1	Ah te voilà. 
1	Par ma foi, ton maître est plaisamment attrapé, et je trouve ceci aussi drôle que les coups de bâton de tantôt dont on m'a fait récit. 
1	Ta maîtresse dit qu'il ronfle à cette heure comme tous les diantres, et il ne sait pas que Monsieur le Vicomte et elle sont ensemble pendant qu'il dort. 
1	Je voudrais bien savoir quel songe il fait maintenant. 
1	Cela est tout à fait risible ! 
1	De quoi s'avise-t-il aussi d'être jaloux de sa femme, et de vouloir qu'elle soit à lui tout seul ? 
1	C'est un impertinent, et Monsieur le Vicomte lui fait trop d'honneur. 
1	Tu ne dis mot,  
1	Allons, suivons-les, et me donne ta petite menotte que je la baise. 
1	Ah que cela est doux. 
1	Il me semble, que je mange des confitures. 
1	Comme il baise la main de Dandin, Dandin la lui pousse rudement au visage.
1	Tubleu, comme vous y allez ! 
1	Voilà une petite menotte qui est un peu bien rude.
1	Qui va là ?
1	Personne.
1	Il fuit, et me laisse informé de la nouvelle perfidie de ma coquine. 
1	Allons, il faut que sans tarder j'envoie appeler son père et sa mère, et que cette aventure me serve à me faire séparer d'elle. 
1	Holà, Colin, Colin.
1	Colin, 
1	COLIN, à la fenêtre.
1	Monsieur.
1	Allons vite, ici-bas.
1	COLIN, en sautant par la fenêtre.
1	M'y voilà ! 
1	On ne peut pas plus vite.
1	Tu es là ?
1	COLIN.
1	Oui, Monsieur.
1	Pendant qu'il va lui parler d'un côté, Colin va de l'autre.
1	Doucement. 
1	Parle bas. 
1	Écoute. 
1	Va-t'en chez mon beau-père et ma belle-mère, et dis que je les prie très instamment de venir tout à l'heure ici. 
1	Entends-tu ? 
1	Eh ? 
1	Colin, Colin.
1	COLIN, de l'autre côté.
1	Monsieur.
1	Où diable es-tu ?
1	COLIN.
1	Ici.
1	Comme ils se vont tous deux chercher, l'un passe d'un côté, et l'autre de l'autre.
1	Peste soit du maroufle qui s'éloigne de moi ! 
1	Je te dis que tu ailles, de ce pas trouver mon beau-père et ma belle-mère, et leur dire que je les conjure de se rendre ici tout à l'heure. 
1	M'entends-tu bien ? 
1	Réponds. 
1	Colin, Colin.
1	COLIN, de l'autre côté.
1	Monsieur.
1	Voilà un pendard qui me fera enrager. 
1	Viens-t-en à moi. 
1	Ils se cognent.
1	Ah le traître ! 
1	Il m'a estropié. 
1	Où est-ce que tu es ? 
1	Approche, que je te donne mille coups. 
1	Je pense qu'il me fuit.
1	COLIN.
1	Assurément.
1	Veux-tu venir ?
1	COLIN.
1	Nenni ma foi !
1	Viens, te dis-je.
1	COLIN.
1	Point, vous me voulez battre.
1	Hé bien non. 
1	Je ne te ferai rien.
1	COLIN.
1	Assurément ?
1	Oui. 
1	Approche. 
1	Bon. 
1	Tu es bien heureux de ce que j'ai besoin de toi. 
1	Va-t'en vite de ma part prier mon beau-père et ma belle-mère de se rendre ici le plus tôt qu'ils pourront, et leur dis que c'est pour une affaire de la dernière conséquence. 
1	Et s'ils faisaient quelque difficulté à cause de l'heure, ne manque pas de les presser, et de leur bien faire entendre qu'il est très important qu'ils viennent en quelque état qu'ils soient. 
1	Tu m'entends bien maintenant ?
1	COLIN.
1	Oui, Monsieur.
1	Va vite, et reviens de même. 
1	Et moi, je vais rentrer dans ma maison, attendant que... 
1	Mais j'entends quelqu'un. 
1	Ne serait-ce point ma femme ? 
1	Il faut que j'écoute, et me serve de l'obscurité qu'il fait.
1	Adieu. 
1	Il est temps de se retirer.
1	Quoi si tôt ?
1	Nous nous sommes assez entretenus.
1	Ah ! 
1	Madame, puis-je assez vous entretenir, et trouver en si peu de temps toutes les paroles dont j'ai besoin ? 
1	Il me faudrait des journées entières pour me bien expliquer à vous de tout ce que je sens ; et je ne vous ai pas dit encore la moindre partie de ce que j'ai à vous dire.
1	Nous en écouterons une autre fois davantage.
1	Hélas ! 
1	De quel coup me percez-vous l'âme, lorsque vous parlez de vous retirer, et avec combien de chagrins m'allez-vous laisser maintenant ?
1	Nous trouverons moyen de nous revoir.
1	Oui. 
1	Mais je songe qu'en me quittant, vous allez trouver un mari. 
1	Cette pensée m'assassine, et les privilèges qu'ont les maris sont des choses cruelles pour un amant qui aime bien.
1	Serez-vous assez fort pour avoir cette inquiétude, et pensez-vous qu'on soit capable d'aimer de certains maris qu'il y a. 
1	On les prend, parce qu'on ne s'en peut défendre, et que l'on dépend de parents qui n'ont des yeux que pour le bien, mais on sait leur rendre justice, et l'on se moque fort de les considérer au delà de ce qu'ils méritent.
1	Voilà nos carognes de femmes.
1	Ah ! 
1	Qu'il faut avouer que celui qu'on vous a donné était peu digne de l'honneur qu'il a reçu, et que c'est une étrange chose que l'assemblage qu'on a fait d'une personne comme vous avec un homme comme lui !
1	Pauvres maris ! 
1	Voilà comme on vous traite.
1	Vous méritez sans doute une autre destinée, et le Ciel ne vous a point faite pour être la femme d'un paysan.
1	Plût au Ciel ! 
1	Fût-elle la tienne, tu changerais bien de langage. 
1	Rentrons. 
1	C'en est assez.
1	Il entre et ferme la porte.
1	Madame, si vous avez à dire du mal de votre mari, dépêchez vite, car il est tard.
1	Ah,  que tu es cruelle !
1	Elle a raison. 
1	Séparons-nous.
1	Il faut donc s'y résoudre, puisque vous le voulez. 
1	Mais au moins je vous conjure de me plaindre un peu, des méchants moments que je vais passer.
1	Adieu.
1	Où es-tu,  que je te donne le bonsoir.
1	Va, va, je le reçois de loin, et je t'en renvoie autant.
1	Rentrons sans faire de bruit.
1	La porte s'est fermée.
1	J'ai le passe-partout.
1	Ouvrez donc doucement.
1	On a fermé en dedans, et je ne sais comment nous ferons.
1	Appelez le garçon qui couche là.
1	Colin, Colin, Colin.
1	mettant la tête à sa fenêtre.
1	Colin, Colin ? 
1	Ah ! 
1	Je vous y prends donc, Madame ma femme, et vous faites des escampativos pendant que je dors. 
1	Je suis bien aise de cela, et de vous voir dehors à l'heure qu'il est.
1	Hé bien ! 
1	Quel grand mal est-ce qu'il y a à prendre le frais de la nuit ?
1	Oui, oui. 
1	L'heure est bonne à prendre le frais. 
1	C'est bien plutôt le chaud, Madame la coquine ; et nous savons toute l'intrigue du rendez-vous, et du Damoiseau. 
1	Nous avons entendu votre galant entretien, et les beaux vers à ma louange que vous avez dits l'un et l'autre. 
1	Mais ma consolation c'est que je vais être vengé, et que votre père et votre mère seront convaincus maintenant de la justice de mes plaintes, et du dérèglement de votre conduite. 
1	Je les ai envoyé quérir, et ils vont être ici dans un moment.
1	Ah Ciel !
1	Madame.
1	Voilà un coup sans doute où vous ne vous attendiez pas. 
1	C'est maintenant que je triomphe, et j'ai de quoi mettre à bas votre orgueil, et détruire vos artifices. 
1	Jusques ici vous avez joué mes accusations, ébloui vos parents, et plâtré vos malversations. 
1	J'ai eu beau voir, et beau dire, et votre adresse toujours l'a emporté sur mon bon droit, et toujours vous avez trouvé moyen d'avoir raison. 
1	Mais à cette fois, Dieu merci, les choses vont être éclaircies, et votre effronterie sera pleinement confondue.
1	Hé je vous prie, faites-moi ouvrir la porte.
1	Non, non il faut attendre la venue de ceux que j'ai mandés, et je veux qu'ils vous trouvent dehors à la belle heure qu'il est. 
1	En attendant qu'ils viennent, songez, si vous voulez à chercher dans votre tête quelque nouveau détour pour vous tirer de cette affaire, à inventer quelque moyen de rhabiller votre escapade. 
1	À trouver quelque belle ruse pour éluder ici les gens et paraître innocente. 
1	Quelque prétexte spécieux de pèlerinage nocturne, ou d'amie en travail d'enfant que vous veniez de secourir.
1	Non, mon intention n'est pas de vous rien déguiser. 
1	Je ne prétends point me défendre, ni vous nier les choses, puisque vous les savez.
1	C'est que vous voyez bien que tous les moyens vous en sont fermés, et que dans cette affaire vous ne sauriez inventer d'excuse qu'il ne me soit facile de convaincre de fausseté.
1	Oui je confesse que j'ai tort, et que vous avez sujet de vous plaindre. 
1	Mais je vous demande par grâce de ne m'exposer point maintenant à la mauvaise humeur de mes parents, et de me faire promptement ouvrir.
1	Je vous baise les mains.
1	Eh mon pauvre petit mari. 
1	Je vous en conjure !
1	Ah ! 
1	Mon pauvre petit mari ? 
1	Je suis votre petit mari maintenant, parce que vous vous sentez prise. 
1	Je suis bien aise de cela, et vous ne vous étiez jamais avisée de me dire de ces douceurs.
1	Tenez. 
1	Je vous promets de ne vous plus donner aucun sujet de déplaisir, et de me...
1	Tout cela n'est rien. 
1	Je ne veux point perdre cette aventure, et il m'importe qu'on soit une fois éclairci à fond de vos déportements.
1	De grâce, laissez-moi vous dire. 
1	Je vous demande un moment d'audience.
1	Hé bien quoi ?
1	Il est vrai que j'ai failli, je vous l'avoue encore une fois, et que votre ressentiment est juste. 
1	Que j'ai pris le temps de sortir pendant que vous dormiez, et que cette sortie est un rendez-vous que j'avais donné à la personne que vous dites. 
1	Mais enfin ce sont des actions que vous devez pardonner à mon âge ; des emportements de jeune personne qui n'a encore rien vu, et ne fait que d'entrer au monde. 
1	Des libertés où l'on s'abandonne sans y penser de mal, et qui sans doute dans le fond n'ont rien de...
1	Oui vous le dites, et ce sont de ces choses qui ont besoin qu'on les croie pieusement.
1	Je ne veux point m'excuser par là d'être coupable envers vous, et je vous prie seulement d'oublier une offense, dont je vous demande pardon de tout mon coeur ; et de m'épargner en cette rencontre le déplaisir que me pourraient causer les reproches fâcheux de mon père et de ma mère. 
1	Si vous m'accordez généreusement la grâce que je vous demande ; ce procédé obligeant, cette bonté que vous me ferez voir, me gagnera entièrement. 
1	Elle touchera tout à fait mon coeur, et y fera naître pour vous ce que tout le pouvoir de mes parents et les liens du mariage n'avaient pu y jeter. 
1	En un mot, elle sera cause que je renoncerai à toutes les galanteries, et n'aurai de l'attachement que pour vous. 
1	Oui, je vous donne ma parole que vous m'allez voir désormais la meilleure femme du monde, et que je vous témoignerai tant d'amitié, que vous en serez satisfait.
1	Ah ! 
1	Crocodile, qui flatte les gens pour les étrangler.
1	Accordez-moi cette faveur.
1	Point d'affaires. 
1	Je suis inexorable.
1	Montrez-vous généreux.
1	Non.
1	De grâce !
1	Point.
1	Je vous en conjure de tout mon coeur !
1	Non, non, non. 
1	Je veux qu'on soit détrompé de vous, et que votre confusion éclate.
1	Hé bien si vous me réduisez au désespoir, je vous avertis qu'une femme en cet état est capable de tout, et que je ferai quelque chose ici dont vous vous repentirez.
1	Et que ferez-vous, s'il vous plaît ?
1	Mon coeur se portera jusqu'aux extrêmes résolutions, et de ce couteau que voici je me tuerai sur la place.
1	Ah ! 
1	Ah ! 
1	À la bonne heure !
1	Pas tant à la bonne heure pour vous, que vous vous imaginez. 
1	On sait de tous côtés nos différends, et les chagrins perpétuels que vous concevez contre moi. 
1	Lorsqu'on me trouvera morte, il n'y aura personne qui mette en doute que ce ne soit vous qui m'aurez tué ; et mes parents ne sont pas gens assurément à laisser cette mort impunie, et ils en feront sur votre personne toute la punition que leur pourront offrir et les poursuites de la justice, et la chaleur de leur ressentiment. 
1	C'est par là que je trouverai moyen de me venger de vous, et je ne suis pas la première qui ait su recourir à de pareilles vengeances, qui n'ait pas fait difficulté de se donner la mort, pour perdre ceux qui ont la cruauté de nous pousser à la dernière extrémité.
1	Je suis votre valet. 
1	On ne s'avise plus de se tuer soi-même, et la mode en est passée il y a longtemps.
1	C'est une chose dont vous pouvez vous tenir sûr ; et si vous persistez dans votre refus, si vous ne me faites ouvrir, je vous jure que tout à l'heure je vais vous faire voir jusques où peut aller la résolution d'une personne qu'on met au désespoir.
1	Bagatelles, bagatelles. 
1	C'est pour me faire peur.
1	Hé bien puisqu'il le faut, voici qui nous contentera tous deux, et montrera si je me moque. 
1	Ah ! 
1	C'en est fait. 
1	Fasse le Ciel que ma mort soit vengée comme je le souhaite, et que celui qui en est cause reçoive un juste châtiment de la dureté qu'il a eue pour moi.
1	Ouais ! 
1	Serait-elle bien si malicieuse que de s'être tuée pour me faire pendre ? 
1	Prenons un bout de chandelle pour aller voir.
1	St. 
1	Paix ! 
1	Rangeons-nous chacune immédiatement contre un des côtés de la porte.
1	La méchanceté d'une femme irait-elle bien jusque-là ? 
1	Il sort avec un bout de chandelle sans les apercevoir, elles entrent, aussitôt elles ferment la porte.
1	Il n'y a personne. 
1	Eh je m'en étais bien douté, et la pendarde s'est retirée, voyant qu'elle ne gagnait rien après moi, ni par prières ni par petites menaces. 
1	Tant mieux cela rendra ses affaires encore plus mauvaises, et le père et la mère qui vont venir en verront mieux son crime. 
1	Ah ah la porte s'est fermée. 
1	Holà ho quelqu'un. 
1	Qu'on m'ouvre promptement !
1	à la fenêtre avec 
1	Comment c'est toi ! 
1	D'où viens-tu, bon pendard ? 
1	Est-il l'heure de revenir chez soi quand le jour est près de paraître ? 
1	Et cette manière de vie est-elle celle que doit suivre un honnête mari ?
1	Cela est-il beau d'aller ivrogner toute la nuit ? 
1	Et de laisser ainsi toute seule une pauvre jeune femme dans la maison ?
1	Comment vous avez...
1	Va, va, traître, je suis lasse de tes déportements, et je m'en veux plaindre, sans plus tarder, à mon père et à ma mère.
1	Quoi ? 
1	C'est ainsi que vous osez...
1	Monsieur et  Colin,   
1	Monsieur et sont en habits de nuit, et conduits par Colin qui porte une lanterne.
1	Approchez de grâce, et venez me faire raison de l'insolence la plus grande du monde, d'un mari à qui le vin et la jalousie ont troublé de telle sorte la cervelle, qu'il ne sait plus ni ce qu'il dit, ni ce qu'il fait, et vous a lui-même envoyé quérir pour vous faire témoins de l'extravagance la plus étrange dont on ait jamais ouï parler. 
1	Le voilà qui revient comme vous voyez, après s'être fait attendre toute la nuit, et si vous voulez l'écouter, il vous dira qu'il a les plus grandes plaintes du monde à vous faire de moi ; que durant qu'il dormait, je me suis dérobée d'auprès de lui pour m'en aller courir, et cent autres contes de même nature qu'il est allé rêver.
1	Voilà une méchante carogne.
1	Oui, il nous a voulu faire accroire qu'il était dans la maison, et que nous en étions dehors, et c'est une folie qu'il n'y a pas moyen de lui ôter de la tête.
1	Comment, qu'est-ce à dire cela ?
1	Voilà une furieuse impudence que de nous envoyer quérir.
1	Jamais.
1	Non, mon père, je ne puis plus souffrir un mari de la sorte. 
1	Ma patience est poussée à bout, et il vient de me dire cent paroles injurieuses.
1	Corbleu vous êtes un malhonnête homme.
1	C'est une conscience de voir une pauvre jeune femme traitée de la façon, et cela crie vengeance au Ciel.
1	Peut-on... 
1	Allez, vous devriez mourir de honte.
1	Laissez-moi vous dire deux mots.
1	Vous n'avez qu'à l'écouter, il va vous en conter de belles.
1	Je désespère.
1	Il a tant bu, que je ne pense pas qu'on puisse durer contre lui, et l'odeur du vin qu'il souffle est montée jusqu'à nous.
1	Monsieur mon beau-père, je vous conjure...
1	Retirez-vous. 
1	Vous puez le vin à pleine bouche.
1	Madame, je vous prie...
1	Fi ne m'approchez pas. 
1	Votre haleine est empestée.
1	Souffrez que je vous...
1	Retirez-vous, vous dis-je. 
1	On ne peut vous souffrir.
1	Permettez de grâce que...
1	Pouah, vous m'engloutissez le coeur. 
1	Parlez de loin, si vous voulez.
1	Hé bien oui, je parle de loin. 
1	Je vous jure que je n'ai bougé de chez moi, et que c'est elle qui est sortie.
1	Ne voilà pas ce que je vous ai dit ?
1	Vous voyez quelle apparence il y a.
1	Allez. 
1	Vous vous moquez des gens. 
1	Descendez, ma fille, et venez ici.
1	J'atteste le Ciel que j'étais dans la maison, et que...
1	Taisez-vous, c'est une extravagance qui n'est pas supportable.
1	Que la foudre m'écrase tout à l'heure, si...
1	Ne nous rompez pas davantage la tête et songez à demander pardon à votre femme.
1	Moi demander pardon ?
1	Oui pardon, et sur-le-champ.
1	Quoi je...
1	Corbleu si vous me répliquez. 
1	Je vous apprendrai ce que c'est que de vous jouer à nous.
1	Ah !
1	Allons, venez ma fille, que votre mari vous demande pardon.
1	descendue.
1	Moi ? 
1	Lui pardonner tout ce qu'il m'a dit ? 
1	Non, non, mon père, il m'est impossible de m'y résoudre, et je vous prie de me séparer d'un mari avec lequel je ne saurais plus vivre.
1	Le moyen d'y résister ?
1	Ma fille, de semblables séparations ne se font point sans grand scandale, et vous devez vous montrer plus sage que lui, et patienter encore cette fois.
1	Comment patienter après de telles indignités ? 
1	Non, mon père, c'est une chose où je ne puis consentir.
1	Il le faut, ma fille, et c'est moi qui vous le commande.
1	Ce mot me ferme la bouche, et vous avez sur moi une puissance absolue.
1	Quelle douceur !
1	Il est fâcheux d'être contrainte d'oublier de telles injures, mais quelle violence que je me fasse, c'est à moi de vous obéir.
1	Pauvre mouton !
1	Approchez.
1	Tout ce que vous me faites faire ne servira de rien, et vous verrez que ce sera dès demain à recommencer.
1	Nous y donnerons ordre. 
1	Allons, mettez-vous à genoux.
1	À genoux ?
1	Oui, à genoux, et sans tarder.
1	Il se met à genoux.
1	Ô Ciel ! 
1	Que faut-il dire ?
1	Madame, je vous prie de me pardonner.
1	Madame, je vous prie de me pardonner.
1	L'extravagance que j'ai faite.
1	L'extravagance que j'ai faite.
1	de vous épouser.
1	Et je vous promets de mieux vivre à l'avenir.
1	Et je vous promets de mieux vivre à l'avenir.
1	Prenez-y garde, et sachez que c'est ici la dernière de vos impertinences que nous souffrirons.
1	Jour de Dieu, si vous y retournez, on vous apprendra le respect que vous devez à votre femme, et à ceux de qui elle sort.
1	Voilà le jour qui va paraître. 
1	Adieu.
1	Rentrez chez vous, et songez bien à être sage. 
1	Et nous, mamour, allons nous mettre au lit.
1	Ah ! 
1	Je le quitte maintenant, et je n'y vois plus de remède, lorsqu'on a, comme moi épousé une méchante femme, le meilleur parti qu'on puisse prendre, c'est de s'aller jeter dans l'eau la tête la première.
0	Ils sont sortis, Olympe ? Ah mortelles douleurs !
0	Qu'un moment de repos me va coûter de pleurs !
0	Mes yeux depuis six mois étaient ouverts aux larmes,
0	Et le sommeil les ferme en de telles alarmes ?
0	Il devait bien plutôt les fermer à jamais,
0	Que de favoriser le plus noirs des forfaits.
0	Mais en sont-ils aux mains ?
0	Du haut de la muraille,
0	Je les ai vus déjà tous rangés en bataille,
0	J'ai vu déjà le fer briller de toutes parts,
0	Et pour vous avertir, j'ai quitté les remparts.
0	J'ai vu le fer en main Étéocle lui-même ;
0	Il marche des premiers, et d'une ardeur extrême
0	Il montre aux plus hardis à braver le danger.
0	N'en doutons plus, Olympe, ils se vont égorger.
0	À un page.
0	Que l'on aille au plus vite avertir la Princesse,
0	Je l'attends. Juste ciel ! Soutenez ma faiblesse,
0	Il faut, il faut courir après ces inhumains,
0	Il les faut séparer, ou mourir par leurs mains.
0	Nous voici donc, Olympe, à ce jour détestable
0	Nous voici donc, Olympe, me rendait misérable
0	Dont la seule frayeur, ni pleurs ne m'ont de rien servi,
0	Et le courroux du sort voulait être assouvi.
0	Ô toi, qui que tu sois qui rends le jour au monde,
0	Que ne l'as-tu laissé dans une nuit profonde ?
0	À de si noirs forfaits, prêtes-tu tes rayons,
0	Et peux-tu sans horreur voir ce que nous voyons ?
0	Mais ces monstres, hélas ! Ne t'épouvantent guère,
0	Le seul sang de Laïus les a rendus vulgaires ;
0	Tu peux voir sans frayeur les crimes de mes fils,
0	Après ceux que le père et la mère ont commis :
0	Tu ne t'étonnes pas si mes fils sont perfides,
0	S'ils sont tous deux méchants, et s'ils sont parricides,
0	Tu sais qu'ils sont sortis d'un sang incestueux,
0	Et tu t'étonnerais s'ils étaient vertueux.
0	Ce sang en leur donnant la lumière céleste,
0	Leur donna pour le crime un pente funeste,
0	Et leurs coeurs infectés de ce fatal poison,
0	S'ouvrirent à la haine avant qu'à la raison.
0	Jocaste, Antigone, Ma fille, avez-vous su l'excès de nos misères.
0	Oui, Madame, on m'a dit la fureur de mes frères.
0	Allons, chère Antigone, allons tout de ce pas,
0	Arrêter s'il se peut leur parricide bras.
0	Allons leur faire voir ce qu'ils ont de plus tendre ;
0	Voyons si contre nous ils pourront se défendre,
0	Ou s'ils oseront bien dans leur noire fureur
0	Répandre notre sang pour attaquer le leur.
0	Madame, c'en est fait, voici le Roi lui-même.
0	Jocaste, Antigone, Étéocle, Olympe, soutiens-moi, ma douleur est extrême.
0	Madame qu'avez-vous ? Et quel mal si caché...
0	Ah ! Mon fils, de quel sang êtes vous-là taché ?
0	Est-ce de votre frère, ou n'est-ce point du vôtre ?
0	Non Madame, ce n'est ni de l'un ni de l'autre,
0	Poynice à mes yeux ne s'est point présenté,
0	Et l'on s'est peu battu d'un et d'autre côté.
0	Seulement quelques grecs d'un insolent courage,
0	M'ayant osé d'abord disputé le passage,
0	J'ai fait mordre la poudre à ces audacieux,
0	Et leur sang est celui qui paraît à vos yeux.
0	Mais pourquoi donc sortir avec votre armée,
0	Quel est ce mouvement qui m'a tant alarmée ?
0	Madame, il était temps que j'en usasse ainsi,
0	Et je perdais ma gloire à demeurer ici.
